id	enabled	severity	scope	glob	kind	params	message	remediation
PLN-CP-001	true	MEDIUM	control-plane	plan.md	file_regex_required_any	regex=(?i)^## Summary$	`plan.md` is missing the required `Summary` section.	Add `## Summary` and keep it limited to planning-control-plane purpose and scope.
PLN-CP-002	true	MEDIUM	control-plane	plan.md	file_regex_required_any	regex=(?i)^## Handoff Protocol$	`plan.md` is missing the required `Handoff Protocol` section.	Add `## Handoff Protocol` and keep routing rules explicit for `/sdd.plan.*`, `/sdd.tasks`, and queue ownership.
PLN-CP-005	true	MEDIUM	control-plane	plan.md	file_regex_required_any	regex=(?i)^## Shared Context Snapshot$	`plan.md` is missing the required `Shared Context Snapshot` section.	Add `## Shared Context Snapshot` and keep it limited to shared bootstrap facts.
PLN-CP-006	true	MEDIUM	control-plane	plan.md	file_regex_required_any	regex=(?i)^## Stage Queue$	`plan.md` is missing the required `Stage Queue` section.	Add `## Stage Queue` and keep fixed queue rows for planning orchestration.
PLN-CP-007	true	MEDIUM	control-plane	plan.md	file_regex_required_any	regex=(?i)^## Binding Projection Index$	`plan.md` is missing the required `Binding Projection Index` section.	Add `## Binding Projection Index` and keep only minimal projection fields.
PLN-CP-008	true	MEDIUM	control-plane	plan.md	file_regex_required_any	regex=(?i)^## Artifact Status$	`plan.md` is missing the required `Artifact Status` section.	Add `## Artifact Status` and keep per-binding artifact queue status only.
PLN-CP-003	false	MEDIUM	control-plane	plan.md	file_regex_required_any	regex=(?i)^## Complexity Tracking$	`plan.md` is missing the required `Complexity Tracking` section.	Add `## Complexity Tracking` and keep it reserved for justified constitution violations only.
PLN-CP-004	true	HIGH	control-plane	plan.md	plan_status_consistency		`plan.md` Feature Identity status is inconsistent with current Stage Queue / Artifact Status progress.	Set `Feature Identity -> Status` to `planning-not-started`, `planning-in-progress`, or `planning-complete` so it matches the actual control-plane state.
PLN-BA-001	true	HIGH	tuple-bindings	*.md	file_regex_forbidden	regex=(?i)(Boundary\s*Anchor[^\n]{0,64}\bBA-[A-Za-z0-9_-]+\b|\|\s*BA-[A-Za-z0-9_-]+\s*\|)	Abstract Boundary Anchor token (BA-*) is used where concrete implementation surface is required.	Replace BA-* placeholders with concrete boundary anchors tied to repository-backed surfaces.
PLN-RA-001	true	HIGH	contracts	contracts/*	file_regex_required_any	regex=(?i)(Boundary[ _-]*Anchor|Repo[ _-]*Anchor(?:s)?|TODO\(REPO_ANCHOR\))	Contracts are missing Boundary Anchor or repo-anchor declaration (or explicit TODO(REPO_ANCHOR) blocker).	Add the normative `Boundary Anchor`, keep repo-anchor evidence in `Upstream References`, or mark unresolved items with TODO(REPO_ANCHOR).
PLN-RA-002	true	HIGH	contracts	contracts/*	file_regex_required_any	regex=(?i)(Anchor[ _-]*Status|Repo[ _-]*Anchor[ _-]*Status)	Contracts are missing explicit Anchor Status declaration required by the repo-anchor decision protocol.	Add `Anchor Status` (or legacy `Repo Anchor Status`) and keep it aligned to `existing|extended|new|todo`.
PLN-RA-003	true	HIGH	data-model	data-model.md	file_regex_required_any	regex=(?i)\bAnchor[ _-]*Status\b	Data model is missing Anchor Status fields required by the repo-anchor decision protocol.	Add `Anchor Status` fields and keep them aligned to `existing|extended|new|todo`.
PLN-RA-004	true	HIGH	test-matrix	test-matrix.md	file_regex_required_any	regex=(?i)^##[ \t]+Binding[ _-]*Packets	Test matrix is missing the `Binding Packets` section required by template-baseline binding projection governance.	Add `## Binding Packets` and keep packet rows aligned to stable binding projection semantics.
PLN-RA-004A	true	HIGH	test-matrix	test-matrix.md	file_regex_required_any	regex=(?i)UIF[ _-]*Path[ _-]*Ref\(s\)	Test matrix is missing `UIF Path Ref(s)` required by template-baseline binding projection governance.	Add `UIF Path Ref(s)` to `Binding Packets` and keep values aligned to the selected UIF path family.
PLN-RA-005	true	HIGH	contracts	contracts/*	file_regex_required_any	regex=(?i)\bBoundary[ _-]*Anchor\b	Contracts are missing explicit Boundary Anchor declaration for northbound binding.	Add `Boundary Anchor` and keep it aligned to the first consumer-callable entry.
PLN-RA-006	true	HIGH	contracts	contracts/*	file_regex_required_any	regex=(?i)Implementation[ _-]*Entry[ _-]*Anchor[ _-]*Status	Contracts are missing Implementation Entry Anchor Status required by the repo-anchor decision protocol.	Add `Implementation Entry Anchor Status` and keep it aligned to `existing|extended|new|todo`.
PLN-RA-007	true	HIGH	tuple-bindings	*.md	anchor_status_allowed_values	allowed=existing,extended,new,todo	Anchor Status uses values outside the allowed repo-anchor decision protocol vocabulary.	Use only `existing`, `extended`, `new`, or `todo` for all anchor-status fields.
PLN-RA-008	true	HIGH	tuple-bindings	*.md	file_regex_forbidden	regex=(?i)(Repo[ _-]*Anchor(?:\(s\))?|Implementation[ _-]*Entry[ _-]*Anchor)[^\n]{0,160}\b[\w./-]+\.[\w-]+:[A-Za-z_$][\w.$-]*\b	Repo anchor target is not using strict path::symbol format.	Use strict `path::symbol` format for repo anchors; single-colon `path:Symbol` is invalid.
PLN-RA-009	true	HIGH	tuple-bindings	*.md	repo_anchor_paths_exist		Repo anchor `path::symbol` points to a file that does not exist under the feature repo root.	Keep unresolved anchors as `TODO(REPO_ANCHOR)` until the target file exists, or change the anchor to a real repository-backed path.
PLN-RA-010	true	HIGH	contracts	contracts/*	repo_anchor_paths_exist		Repo anchor `path::symbol` points to a file that does not exist under the feature repo root.	Keep unresolved anchors as `TODO(REPO_ANCHOR)` until the target file exists, or change the anchor to a real repository-backed path.
PLN-RA-011	true	HIGH	data-model	data-model.md	file_regex_required_any	regex=(?i)\bAnchor[ _-]*Role\b	Data model is missing Anchor Role fields required by the repo-anchor role taxonomy.	Add `Anchor Role` and align values to `owner|state-source|projection-source|carrier|partial-lineage`.
PLN-RA-012	true	HIGH	test-matrix	test-matrix.md	file_regex_required_any	regex=(?i)UDD[ _-]*Ref\(s\)	Test matrix is missing `UDD Ref(s)` fields required by template-baseline binding packets.	Add `UDD Ref(s)` to `Binding Packets` and keep values aligned to spec-backed data semantics.
PLN-RA-015	true	HIGH	contracts	contracts/*	shared_semantic_reuse_enum	allowed=shared-semantic-element,owner-source-alignment,shared-field-vocabulary,lifecycle-invariant,downstream-contract-constraint,none	Contract `Shared Semantic Reuse` table contains invalid constraint types.	Use only `shared-semantic-element`, `owner-source-alignment`, `shared-field-vocabulary`, `lifecycle-invariant`, `downstream-contract-constraint`, or `none`.
PLN-RA-016	true	HIGH	contracts	contracts/*	file_regex_forbidden	regex=(?i)(\[BindingRowID\]|\[operationId\]|Used in \[operationId\]|<BoundaryRequestModel>|<ContractBoundaryEntry>|<BoundaryResponseModel>|<ImplementationEntryAnchor>|<AnchoredCollaboratorSymbol>|<AnchoredMiddlewareSymbol>|<AnchoredSecondOrThirdPartySymbol>|<DomainEntityOrDO>|<ClientOrCaller>|<ContractBoundaryAnchor>|<ImplementationEntryAnchor>|<AnchoredSecondPartyCollaborator>|<AnchoredThirdPartyDependency>|\[operation request\]|TODO\(SYMBOL\))	Contract contains template placeholders or unresolved symbol placeholders.	Replace all template placeholders (e.g., `[operationId]`, angle-bracket labels) with concrete names and resolve all symbols.
PLN-RA-017	true	HIGH	contracts	contracts/*	anchor_strategy_evidence_required		Contract `new` anchors are missing required `existing rejected:` and `extended rejected:` strategy evidence.	Fill `Boundary Anchor Strategy Evidence` and `Implementation Entry Anchor Strategy Evidence` with explicit rejection reasons for `existing` and `extended` before using `new`.
PLN-TM-001	true	HIGH	test-matrix	test-matrix.md	file_regex_required_any	regex=(?i)^##[ \t]+Interface[ _-]*Partition[ _-]*Decisions	Test matrix is missing `Interface Partition Decisions` required by the latest stage contract.	Add `## Interface Partition Decisions` and keep northbound binding splits authoritative there.
PLN-TM-002	true	HIGH	test-matrix	test-matrix.md	file_regex_required_any	regex=(?i)^##[ \t]+UIF[ _-]*Full[ _-]*Path[ _-]*Coverage[ _-]*Graph[ _-]*\(Mermaid\)	Test matrix is missing `UIF Full Path Coverage Graph (Mermaid)` required by the latest stage contract.	Add `## UIF Full Path Coverage Graph (Mermaid)` and keep it spec-derived only.
PLN-TM-003	true	HIGH	test-matrix	test-matrix.md	file_regex_required_any	regex=(?i)^##[ \t]+UIF[ _-]*Path[ _-]*Coverage[ _-]*Ledger	Test matrix is missing `UIF Path Coverage Ledger` required by the latest stage contract.	Add `## UIF Path Coverage Ledger` and account for every selected-scope UIF path exactly once.
PLN-TM-004	true	HIGH	test-matrix	test-matrix.md	file_regex_required_any	regex=(?i)^##[ \t]+Scenario[ _-]*Matrix	Test matrix is missing `Scenario Matrix` required by the latest stage contract.	Add `## Scenario Matrix` and keep scenario-level verification semantics explicit.
PLN-TM-005	true	HIGH	test-matrix	test-matrix.md	file_regex_required_any	regex=(?i)^##[ \t]+Verification[ _-]*Case[ _-]*Anchors	Test matrix is missing `Verification Case Anchors` required by the latest stage contract.	Add `## Verification Case Anchors` and keep TM/TC observability anchors explicit.
PLN-RA-013	true	HIGH	contracts	contracts/*	file_regex_required_any	regex=(?i)repo[ _-]*anchors?[ \t]*:	Contracts are missing explicit repo-anchor declaration required by the unified contract template.	Add `repo anchors:` in `Upstream References` and keep it aligned to boundary/entry/request-response/collaborator/middleware/dependency symbols.
PLN-RA-014	true	HIGH	research	research.md	file_regex_forbidden	regex=(?i)^\|\s*`[^`\n]+`\s*\|\s*`[^`:.]+\/*`\s*\|	Research repo anchors must not use module-root or directory-only paths in `Source Path / Symbol`.	Use a concrete file path or `path/to/file.ext::Symbol`; directory-only values such as `aidm-api/` are invalid research anchors.
PLN-DM-001	true	HIGH	data-model	data-model.md	file_regex_required_any	regex=(?i)^##[ \t]+Shared[ _-]*Semantic[ _-]*Class[ _-]*Model	Data model is missing `Shared Semantic Class Model` required by the latest shared-semantic handoff.	Add `## Shared Semantic Class Model` and keep shared-class landing explicit there.
PLN-DM-002	true	HIGH	data-model	data-model.md	file_regex_required_any	regex=(?i)^##[ \t]+Owner(?:[ \t]*/[ \t]*|[ _-]+)Source[ _-]*Alignment	Data model is missing `Owner / Source Alignment` required by the latest shared-semantic handoff.	Add `## Owner / Source Alignment` and close shared owner/source semantics there.
PLN-DM-003	true	HIGH	data-model	data-model.md	file_regex_required_any	regex=(?i)^##[ \t]+Shared[ _-]*Field[ _-]*Vocabulary	Data model is missing `Shared Field Vocabulary` required by the latest shared-semantic handoff.	Add `## Shared Field Vocabulary` and keep shared semantic vocabulary explicit there.
PLN-DM-004	true	HIGH	data-model	data-model.md	file_regex_required_any	regex=(?i)^##[ \t]+Downstream[ _-]*Contract[ _-]*Constraints	Data model is missing `Downstream Contract Constraints` required by the latest contract handoff.	Add `## Downstream Contract Constraints` and map each dependent binding to required shared semantic refs.
PLN-DM-005	true	HIGH	data-model	data-model.md	file_regex_required_any	regex=(?i)^###[ \t]+State[ _-]*Transition[ _-]*Table	Data model is missing `State Transition Table` required by the lifecycle handoff policy.	Add `### State Transition Table` and make shared transitions explicit for each lifecycle.
PLN-DM-006	true	HIGH	data-model	data-model.md	file_regex_required_any	regex=(?i)Repo[- ]*First[ _-]*Strategy[ _-]*Evidence	Data model is missing `Repo-First Strategy Evidence` required by the shared-semantic landing policy.	Add `Repo-First Strategy Evidence` to `Shared Semantic Elements` and record why `existing` / `extended` were rejected for each `new` row.
PLN-DM-007	true	HIGH	data-model	data-model.md	file_regex_forbidden	regex=(?i)\b[A-Za-z_][A-Za-z0-9_]*(DTO|Request|Response|Command|Result)\b	Data model contains contract-flavored names that do not belong in shared semantics.	Rename shared semantic rows/UML nodes to stable business names and keep DTO/request/response/command/result types in `/sdd.plan.contract`.
PLN-DM-008	true	HIGH	data-model	data-model.md	file_regex_forbidden	regex=(?i)\b[A-Za-z_][A-Za-z0-9_]*(Controller|Service|Facade)\b	Data model contains interface-role names that do not belong in shared semantics.	Keep controller/service/facade labels out of shared semantic rows/UML nodes and use stable business owners/projections/lifecycles instead.
PLN-DM-009	true	HIGH	data-model	data-model.md	file_regex_forbidden	regex=(?i)\|[[:space:]]*new[[:space:]]*\|[[:space:]]*(`?(\[)?N/?A(\])?`?)?[[:space:]]*\|	`Anchor Status = new` rows are missing concrete repo-first strategy evidence.	Fill `Repo-First Strategy Evidence` with why `existing` and `extended` were rejected before using `new`.
PLN-NB-001	true	HIGH	tuple-bindings	*.md	northbound_controller_required	trigger_file=research.md;trigger_regex=(?i)(northbound[^.\n]{0,120}web/controller|northbound APIs in web/controller|web\s*->\s*service);boundary_http_regex=(?i)^`?HTTP\s+[A-Z]+\s+[^`]+`?$;boundary_forbidden_regex=(?i)\b(\w*Facade|\w*Service|\w*Manager|\w*Dao|\w*Mapper)\.[A-Za-z_$][\w$]*\b;entry_controller_regex=(?i)(^|[./:_-])[A-Za-z0-9_$-]*controller[A-Za-z0-9_$-]*([./:_-]|$);entry_forbidden_regex=(?i)(service|manager|dao|mapper|repository|facade);sequence_variant_b_regex=(?i)Sequence\s+Variant\s+B	Northbound binding violates controller-first HTTP entry constraints derived from feature layering.	Use HTTP `METHOD /path` as Boundary Anchor, the owning controller method as Implementation Entry Anchor, and keep service/facade symbols as downstream collaborators.
PLN-BP-001	true	HIGH	control-plane	plan.md	binding_projection_stable_only		`Binding Projection Index` contains contract-design fields that do not belong in the planning control plane.	Keep `Binding Projection Index` limited to minimal binding projection fields only; remove boundary, entry, status, DTO, collaborator, and other contract-design columns.
PLN-BP-002	true	HIGH	control-plane	plan.md	binding_tuple_projection_sync		Selected `BindingRowID` projection drifts across `plan.md` and `test-matrix.md`.	Repair the selected `Binding Packets` row via `/sdd.plan.test-matrix` and regenerate the minimal `Binding Projection Index`; do not use generated contracts to rewrite upstream projections.
PLN-SYM-001	true	MEDIUM	contracts	contracts/*	file_regex_forbidden	regex=(?i)(invented|placeholder|tbd)[-_ ]?(symbol|participant|class|method|component)|TODO\(SYMBOL\)	Contract collaborators include unresolved or invented symbols.	Replace unresolved collaborator symbols with repository-anchored canonical symbols (or block with TODO(REPO_ANCHOR) when unresolved).
PLN-ID-001	true	HIGH	contracts	contracts/*	file_regex_forbidden	regex=(?i)(AnchoredMapper|queryOrUpdate\(\.\.\.\)|\bCaller\b|PoemDictationStudentFacade\s+or\s+PoemDictationParentFacade)	Contracts contain known placeholder/invented symbols or ambiguous boundary-anchor wording.	Replace placeholders with repository-anchored concrete symbols and use one normative boundary anchor per operation.
PLN-ID-002	true	HIGH	contracts	contracts/*	file_regex_required_any	regex=(?i)Binding[ \t]+Context	Contracts are missing explicit `Binding Context` section required by the unified contract template.	Add `## Binding Context` and keep binding locator fields explicit for the selected `BindingRowID`.
PLN-ID-003	true	HIGH	contracts	contracts/*	file_regex_required_any	regex=(?i)Implementation\s+Entry\s+Anchor	Contracts are missing explicit Implementation Entry Anchor required by the unified contract template.	Add an Implementation Entry Anchor and align it to the first internal handoff entry that realizes the contract boundary.
PLN-ID-004	true	HIGH	contracts	contracts/*	file_regex_required_any	regex=(?i)Closure[ \t]+Check	Contracts are missing the `Closure Check` section required for operation-local closure validation.	Add `## Closure Check` and keep unresolved items explicit as `ok/gap` evidence.
PLN-ID-005	true	HIGH	contracts	contracts/*	file_regex_required_any	regex=(?i)Sequence[ \t]+Design	Contracts are missing the `Sequence Design` section required for executable collaboration closure.	Add `## Sequence Design` and keep success/failure paths contiguous with mandatory collaborator and middleware calls.
PLN-ID-006	true	HIGH	contracts	contracts/*	file_regex_required_any	regex=(?i)Interface-definition[ \t]+closure	Contracts are missing the `Interface-definition closure` check row.	Add the row in `Closure Check` and verify request/response surface plus field dictionary plus shared semantic reuse are complete.
PLN-ID-007	true	HIGH	contracts	contracts/*	file_regex_required_any	regex=(?i)Sequence[ \t]+closure	Contracts are missing the `Sequence closure` check row.	Add the row in `Closure Check` and verify success/failure paths cover mandatory second-party, third-party, and middleware calls.
PLN-ID-008	true	HIGH	contracts	contracts/*	file_regex_required_any	regex=(?i)UML[ \t]+closure	Contracts are missing the `UML closure` check row.	Add the row in `Closure Check` and verify class diagram and two-party package relations are present and consistent with sequence.
PLN-ID-009	true	HIGH	contracts	contracts/*	file_regex_required_any	regex=(?i)Test[ \t]+closure	Contracts are missing the `Test closure` check row.	Add the row in `Closure Check` and verify `TM/TC`, pass/failure anchors, and command/assertion signal are complete.
PLN-ID-010	true	HIGH	contracts	contracts/*	file_regex_required_any	regex=(?i)Full\s+Field\s+Dictionary\s+\(Operation-scoped\)	Contracts are missing the operation-scoped full field dictionary required for field-level contract authority.	Add `Full Field Dictionary (Operation-scoped)` and keep it authoritative for owner/default/validation/persisted/source semantics.
PLN-ID-011	true	MEDIUM	contracts	contracts/*	file_regex_required_any	regex=(?i)Contract[ \t]+Summary	Contracts are missing the reader-oriented `Contract Summary` subsection required by the updated unified contract template.	Add `### Contract Summary` under `## Interface Definition` and keep field-level authority in `Full Field Dictionary (Operation-scoped)`.
PLN-ID-012	true	HIGH	contracts	contracts/*	file_regex_required_any	regex=(?i)Test[ \t]+Projection[ \t]+Slice	Contracts are missing `Test Projection Slice` required by the updated contract template.	Add `### Test Projection Slice` and keep IF/Operation/TM/TC/pass-failure anchors plus command/assertion signal explicit.
PLN-ID-013	true	HIGH	contracts	contracts/*	file_regex_required_any	regex=(?i)\bDictionary\s+Tier\b	Contracts are missing `Dictionary Tier` classification required by the updated field dictionary protocol.	Add `Dictionary Tier` to `Full Field Dictionary (Operation-scoped)` and classify rows as `operation-critical|owner-residual`.
PLN-ID-014	true	HIGH	contracts	contracts/*	file_regex_required_any	regex=(?i)Cross[- ]Interface[ \t]+Smoke[ \t]+Candidate	Contracts are missing `Cross-Interface Smoke Candidate` required by downstream smoke orchestration.	Add `### Cross-Interface Smoke Candidate` in `Test Projection` and keep one explicit candidate row for the selected operation.
PLN-ID-015	true	HIGH	contracts	contracts/*	file_regex_required_any	regex=(?i)Resolved[ \t]+Type[ \t]+Inventory	Contracts are missing `Resolved Type Inventory` required for concrete naming closure.	Add `### Resolved Type Inventory` and resolve all contract-visible symbols before marking the contract `done`.
PLN-ID-016	true	HIGH	contracts	contracts/*	file_regex_required_any	regex=(?i)^##[ \t]+Artifact[ _-]*Quality[ _-]*Signals	Contracts are missing `Artifact Quality Signals (Normative)` from the unified contract skeleton.	Restore `## Artifact Quality Signals (Normative)`; simplified contract skeletons are not allowed.
PLN-ID-017	true	HIGH	contracts	contracts/*	file_regex_required_any	regex=(?i)^##[ \t]+Northbound[ _-]*Entry[ _-]*Rules	Contracts are missing `Northbound Entry Rules (Normative)` from the unified contract skeleton.	Restore `## Northbound Entry Rules (Normative)` and keep boundary-entry constraints explicit.
PLN-ID-018	true	HIGH	contracts	contracts/*	file_regex_required_any	regex=(?i)Two[- ]Party[ \t]+Package[ \t]+Relations	Contracts are missing `Two-Party Package Relations` required by UML/package closure.	Add `### Two-Party Package Relations` and model package ownership/dependency direction explicitly.
PLN-LC-001	false	MEDIUM	data-model	data-model.md	file_regex_required_any	regex=(?i)(lifecycle|state +transition|state +machine)	Lifecycle anchors are missing from data model semantics.	Add lifecycle/state-transition anchors where domain semantics require them.
